{
  "versionNumber": "5",
  "updateTime": "2020-11-16T16:35:33.569229Z",
  "updateUser": {
    "name": "Ut ad aute",
    "email": "test@nowhere.com",
    "imageUrl": "http://google.com/favicon.ico"
  },
  "description": "minim reprehenderit Lorem qui proident",
  "updateOrigin": "CONSOLE",
  "updateType": "INCREMENTAL_UPDATE",
  "rollbackSource": 75404139
}